{
  "$schema": "https://json-schema.org/draft/2020-12/schema",
  "$id": "https://raw.githubusercontent.com/SciToolsmith/sci-diagram-pptx/main/skills/sci-diagram-pptx/scripts/scene-plan.schema.json",
  "title": "sci-diagram-pptx scene plan",
  "description": "A deterministic, source-bound plan for rebuilding one scientific or academic schematic as editable slide objects; statistical/data plots are out of scope.",
  "type": "object",
  "additionalProperties": false,
  "required": [
    "schema_version",
    "kind",
    "source",
    "canvas",
    "objects",
    "connections",
    "approvals"
  ],
  "properties": {
    "schema_version": {
      "const": "1.0"
    },
    "kind": {
      "const": "sci-diagram-pptx-scene-plan"
    },
    "source": {
      "$ref": "#/$defs/source"
    },
    "canvas": {
      "$ref": "#/$defs/canvas"
    },
    "objects": {
      "type": "array",
      "items": {
        "$ref": "#/$defs/object"
      }
    },
    "connections": {
      "type": "array",
      "items": {
        "$ref": "#/$defs/connection"
      }
    },
    "approvals": {
      "$ref": "#/$defs/approvals"
    },
    "notes": {
      "type": "string"
    }
  },
  "$defs": {
    "identifier": {
      "type": "string",
      "minLength": 1,
      "pattern": "^[A-Za-z][A-Za-z0-9._:-]*$"
    },
    "source": {
      "type": "object",
      "additionalProperties": false,
      "required": [
        "sha256",
        "format",
        "width_px",
        "height_px"
      ],
      "properties": {
        "path": {
          "type": "string",
          "minLength": 1
        },
        "sha256": {
          "type": "string",
          "pattern": "^[0-9a-fA-F]{64}$"
        },
        "format": {
          "type": "string",
          "minLength": 1
        },
        "width_px": {
          "type": "integer",
          "minimum": 1
        },
        "height_px": {
          "type": "integer",
          "minimum": 1
        },
        "parent_sha256": {
          "type": "string",
          "pattern": "^[0-9a-fA-F]{64}$"
        },
        "parent_width_px": {
          "type": "integer",
          "minimum": 1
        },
        "parent_height_px": {
          "type": "integer",
          "minimum": 1
        },
        "panel_manifest_sha256": {
          "type": "string",
          "pattern": "^[0-9a-fA-F]{64}$"
        },
        "panel_bbox": {
          "description": "Exact panel bounds in the parent image's displayed pixel coordinate space; x/y are zero-based and width/height are positive.",
          "$ref": "#/$defs/pixelBBox"
        },
        "panel_label": {
          "type": "string",
          "minLength": 1
        },
        "panel_selection": {
          "$ref": "#/$defs/panelSelection"
        }
      }
    },
    "panelSelection": {
      "type": "object",
      "additionalProperties": false,
      "required": [
        "selection_source",
        "selected_by",
        "selected_at",
        "evidence"
      ],
      "properties": {
        "selection_source": {
          "const": "user-explicit"
        },
        "selected_by": {
          "type": "string",
          "minLength": 1
        },
        "selected_at": {
          "type": "string",
          "pattern": "^\\d{4}-\\d{2}-\\d{2}T\\d{2}:\\d{2}(?::\\d{2}(?:\\.\\d+)?)?(?:Z|[+-]\\d{2}:\\d{2})$"
        },
        "evidence": {
          "type": "string",
          "minLength": 1
        }
      }
    },
    "pixelBBox": {
      "type": "object",
      "additionalProperties": false,
      "required": [
        "x",
        "y",
        "width",
        "height"
      ],
      "properties": {
        "x": {
          "type": "integer",
          "minimum": 0
        },
        "y": {
          "type": "integer",
          "minimum": 0
        },
        "width": {
          "type": "integer",
          "minimum": 1
        },
        "height": {
          "type": "integer",
          "minimum": 1
        }
      }
    },
    "canvas": {
      "type": "object",
      "additionalProperties": false,
      "required": [
        "coordinate_system",
        "width_inches",
        "height_inches"
      ],
      "properties": {
        "coordinate_system": {
          "const": "normalized-top-left"
        },
        "width_inches": {
          "type": "number",
          "exclusiveMinimum": 0
        },
        "height_inches": {
          "type": "number",
          "exclusiveMinimum": 0
        },
        "background": {
          "type": "object"
        }
      }
    },
    "bbox": {
      "type": "object",
      "additionalProperties": false,
      "required": [
        "x",
        "y",
        "width",
        "height"
      ],
      "properties": {
        "x": {
          "type": "number",
          "minimum": 0,
          "maximum": 1
        },
        "y": {
          "type": "number",
          "minimum": 0,
          "maximum": 1
        },
        "width": {
          "type": "number",
          "exclusiveMinimum": 0,
          "maximum": 1
        },
        "height": {
          "type": "number",
          "exclusiveMinimum": 0,
          "maximum": 1
        },
        "rotation_degrees": {
          "type": "number"
        }
      }
    },
    "reconstruction": {
      "type": "object",
      "additionalProperties": false,
      "required": [
        "mode",
        "expected_ooxml_kind"
      ],
      "properties": {
        "mode": {
          "enum": [
            "native-exact",
            "native-approximation",
            "isolated-raster",
            "unsupported"
          ]
        },
        "expected_ooxml_kind": {
          "type": "string",
          "minLength": 1
        },
        "degradation_id": {
          "$ref": "#/$defs/identifier"
        },
        "rationale": {
          "type": "string"
        }
      }
    },
    "content": {
      "type": "object",
      "required": [
        "text"
      ],
      "properties": {
        "text": {
          "type": "string"
        },
        "math_source": {
          "type": "string"
        },
        "language": {
          "type": "string",
          "minLength": 1
        }
      }
    },
    "objectStyle": {
      "type": "object",
      "required": [
        "shape_geometry"
      ],
      "properties": {
        "shape_geometry": {
          "type": "string",
          "minLength": 1
        },
        "fill": {
          "type": "object"
        },
        "line": {
          "type": "object"
        },
        "text": {
          "type": "object"
        }
      }
    },
    "connectionStyle": {
      "type": "object",
      "required": [
        "kind",
        "arrow_at",
        "dash",
        "line_width_px",
        "line_color"
      ],
      "properties": {
        "kind": {
          "type": "string",
          "minLength": 1
        },
        "arrow_at": {
          "enum": [
            "none",
            "start",
            "end",
            "both"
          ]
        },
        "dash": {
          "type": "string",
          "minLength": 1
        },
        "line_width_px": {
          "type": "number",
          "exclusiveMinimum": 0
        },
        "line_color": {
          "type": "string",
          "minLength": 1
        }
      }
    },
    "object": {
      "type": "object",
      "additionalProperties": false,
      "required": [
        "id",
        "type",
        "source_bbox",
        "bbox",
        "z_order",
        "confidence",
        "reconstruction",
        "content",
        "style"
      ],
      "properties": {
        "id": {
          "$ref": "#/$defs/identifier"
        },
        "type": {
          "type": "string",
          "minLength": 1
        },
        "source_bbox": {
          "$ref": "#/$defs/bbox"
        },
        "bbox": {
          "$ref": "#/$defs/bbox"
        },
        "z_order": {
          "type": "integer",
          "minimum": 0
        },
        "confidence": {
          "type": "number",
          "minimum": 0,
          "maximum": 1
        },
        "reconstruction": {
          "$ref": "#/$defs/reconstruction"
        },
        "content": {
          "$ref": "#/$defs/content"
        },
        "style": {
          "$ref": "#/$defs/objectStyle"
        },
        "children": {
          "type": "array",
          "items": {
            "$ref": "#/$defs/identifier"
          }
        },
        "notes": {
          "type": "string"
        }
      }
    },
    "endpoint": {
      "type": "object",
      "additionalProperties": false,
      "required": [
        "object_id",
        "anchor"
      ],
      "properties": {
        "object_id": {
          "$ref": "#/$defs/identifier"
        },
        "anchor": {
          "type": "string",
          "minLength": 1
        }
      }
    },
    "point": {
      "type": "object",
      "additionalProperties": false,
      "required": [
        "x",
        "y"
      ],
      "properties": {
        "x": {
          "type": "number",
          "minimum": 0,
          "maximum": 1
        },
        "y": {
          "type": "number",
          "minimum": 0,
          "maximum": 1
        }
      }
    },
    "connection": {
      "type": "object",
      "additionalProperties": false,
      "required": [
        "id",
        "from",
        "to",
        "source_route",
        "route",
        "z_order",
        "confidence",
        "reconstruction",
        "style"
      ],
      "properties": {
        "id": {
          "$ref": "#/$defs/identifier"
        },
        "from": {
          "$ref": "#/$defs/endpoint"
        },
        "to": {
          "$ref": "#/$defs/endpoint"
        },
        "z_order": {
          "type": "integer",
          "minimum": 0
        },
        "confidence": {
          "type": "number",
          "minimum": 0,
          "maximum": 1
        },
        "reconstruction": {
          "$ref": "#/$defs/reconstruction"
        },
        "source_route": {
          "type": "array",
          "minItems": 2,
          "items": {
            "$ref": "#/$defs/point"
          }
        },
        "route": {
          "type": "array",
          "minItems": 2,
          "items": {
            "$ref": "#/$defs/point"
          }
        },
        "label_object_id": {
          "$ref": "#/$defs/identifier"
        },
        "style": {
          "$ref": "#/$defs/connectionStyle"
        },
        "notes": {
          "type": "string"
        }
      }
    },
    "degradation": {
      "type": "object",
      "additionalProperties": false,
      "required": [
        "id",
        "entity_ids",
        "reason",
        "approved",
        "approved_by",
        "approved_at",
        "evidence",
        "approval_source"
      ],
      "properties": {
        "id": {
          "$ref": "#/$defs/identifier"
        },
        "entity_ids": {
          "description": "Global scene entity IDs covered by this approval; IDs may identify objects or connections.",
          "type": "array",
          "minItems": 1,
          "items": {
            "$ref": "#/$defs/identifier"
          }
        },
        "reason": {
          "type": "string",
          "minLength": 1
        },
        "approved": {
          "const": true
        },
        "approved_by": {
          "type": "string",
          "minLength": 1
        },
        "approved_at": {
          "type": "string",
          "pattern": "^\\d{4}-\\d{2}-\\d{2}T\\d{2}:\\d{2}(?::\\d{2}(?:\\.\\d+)?)?(?:Z|[+-]\\d{2}:\\d{2})$"
        },
        "evidence": {
          "type": "string",
          "minLength": 1
        },
        "approval_source": {
          "const": "user-explicit"
        }
      }
    },
    "approvals": {
      "type": "object",
      "additionalProperties": false,
      "required": [
        "degradations"
      ],
      "properties": {
        "degradations": {
          "type": "array",
          "items": {
            "$ref": "#/$defs/degradation"
          }
        }
      }
    }
  }
}
